{
    "title": "Building a quantum lock using phase kickback",
    "authors": [
        {
            "id": "danial_motlagh"
        }
    ],
    "dateOfPublication": "2023-08-01T00:00:00+00:00",
    "dateOfLastModification": "2023-08-01T00:00:00+00:00",
    "categories": [
        "Getting Started",
        "Algorithms",
        "Quantum Computing"
    ],
    "tags": [],
    "previewImages": [
        {
            "type": "thumbnail",
            "uri": "/_images/thumbnail_tutorial_phase_kickback.png"
        },
        {
            "type": "large_thumbnail",
            "uri": "/_static/large_demo_thumbnails/thumbnail_large_phase_kickback.png"
        }
    ],
    "seoDescription": "Use phase kickback to create an unbreakable quantum lock",
    "doi": "",
    "canonicalURL": "/qml/demos/tutorial_phase_kickback",
    "references": [],
    "basedOnPapers": [],
    "referencedByPapers": [],
    "relatedContent": [
        {
            "type": "demonstration",
            "id": "tutorial_qubit_rotation",
            "weight": 1.0
        }
    ]
}