{
    "title": "Intro to Quantum Fourier Transform",
    "authors": [
        {
            "id": "guillermo_alonso"
        }
    ],
    "dateOfPublication": "2024-01-30T00:00:00+00:00",
    "dateOfLastModification": "2024-01-30T00:00:00+00:00",
    "categories": [
        "Algorithms",
        "Quantum Computing"
    ],
    "tags": [],
    "previewImages": [
        {
            "type": "thumbnail",
            "uri": "/_static/demonstration_assets/qpe/thumbnail_Quantum_Phase_Estimation_2023-11-27.png"
        },
        {
            "type": "large_thumbnail",
            "uri": "/_static/large_demo_thumbnails/thumbnail_large_Quantum_Phase_Estimation_2023-11-27.png"
        }
    ],
    "seoDescription": "Master the basics of the quantum fourier transform",
    "doi": "",
    "canonicalURL": "/qml/demos/tutorial_qft",
    "references": [],
    "basedOnPapers": [],
    "referencedByPapers": [],
    "relatedContent": []
}