{
    "title": "Linear combination of unitaries and block encodings",
    "authors": [
        {
            "id": "juan_miguel_arrazola"
        },
        {
            "id": "diego_guala"
        },
        {
            "id": "jay_soni"
        }
    ],
    "dateOfPublication": "2023-08-31T00:00:00+00:00",
    "dateOfLastModification": "2023-08-31T00:00:00+00:00",
    "categories": [
        "Algorithms",
        "Quantum Computing"
    ],
    "tags": [],
    "previewImages": [
        {
            "type": "thumbnail",
            "uri": "/_images/thumbnail_tutorial_here_comes_the_sun.png"
        },
        {
            "type": "large_thumbnail",
            "uri": "/_static/large_demo_thumbnails/thumbnail_large_here_comes_the_sun.png"
        }
    ],
    "seoDescription": "Master the basics of LCUs and their applications",
    "doi": "",
    "canonicalURL": "/qml/demos/tutorial_lcu_blockencoding",
    "references": [
        {
            "id": "qsvt",
            "type": "article",
            "title": "Quantum singular value transformation and beyond: exponential improvements for quantum matrix arithmetics",
            "authors": "András Gilyén, Yuan Su, Guang Hao Low, Nathan Wiebe",
            "year": "2019",
            "publisher": "",
            "journal": "",
            "url": "https://dl.acm.org/doi/abs/10.1145/3313276.3316366"
        }
    ],
    "basedOnPapers": [],
    "referencedByPapers": [],
    "relatedContent": [
        {
            "type": "demonstration",
            "id": "tutorial_intro_qsvt",
            "weight": 1.0
        },
        {
            "type": "demonstration",
            "id": "tutorial_apply_qsvt",
            "weight": 1.0
        }
    ]
}
