{
    "title": "QJIT compilation with Qrack and Catalyst",
    "authors": [
        {
            "id": "dan_strano"
        }
    ],
    "dateOfPublication": "2024-07-10T00:00:00+00:00",
    "dateOfLastModification": "2024-07-10T00:00:00+00:00",
    "categories": [
        "Devices and Performance"
    ],
    "tags": [],
    "previewImages": [
        {
            "type": "thumbnail",
            "uri": "/_static/demonstration_assets/regular_demo_thumbnails/thumbnail_qrack_catalyst_integration.png"
        },
        {
            "type": "large_thumbnail",
            "uri": "/_static/large_demo_thumbnails/thumbnail_large_qrack_catalyst_integration.png"
        }
    ],
    "seoDescription": "Quantum JIT compilation (QJIT) using the Qrack device for PennyLane and Catalyst, with GPU-acceleration and novel optimization.",
    "doi": "",
    "canonicalURL": "/qml/demos/qrack",
    "references": [],
    "basedOnPapers": [],
    "referencedByPapers": [],
    "relatedContent": [
        {
            "type": "demonstration",
            "id": "tutorial_qft",
            "weight": 1.0
        },
        {
            "type": "demonstration",
            "id": "tutorial_clifford_circuit_simulations",
            "weight": 1.0
        }
    ]
}
