{
    "title": "Quantum advantage with Gaussian Boson Sampling",
    "authors": [
        {
            "id": "josh_izaac"
        },
        {
            "id": "nathan_killoran"
        }
    ],
    "dateOfPublication": "2020-12-04T00:00:00+00:00",
    "dateOfLastModification": "2020-12-04T00:00:00+00:00",
    "categories": [
        "Quantum Hardware",
        "Quantum Computing"
    ],
    "tags": [],
    "previewImages": [
        {
            "type": "thumbnail",
            "uri": "/_static/demonstration_assets/regular_demo_thumbnails/thumbnail_quantum_advantage_guassian_boson_sampling.png"
        }
    ],
    "seoDescription": "Using light to perform tasks beyond the reach of classical computers.",
    "doi": "",
    "canonicalURL": "/qml/demos/gbs",
    "references": [
        {
            "id": "Arute2019",
            "type": "article",
            "title": "Quantum supremacy using a programmable superconducting processor",
            "authors": "Arute, F., Arya, K., Babbush, R., et al.",
            "year": "2019",
            "journal": "Nature",
            "url": "https://doi.org/10.1038/s41586-019-1666-5"
        },
        {
            "id": "Zhong2020",
            "type": "article",
            "title": "Quantum computational advantage using photons",
            "authors": "Zhong, H.-S., Wang, H., Deng, Y.-H., et al.",
            "year": "2020",
            "journal": "Science",
            "doi": "10.1126/science.abe8770",
            "url": ""
        },
        {
            "id": "hamilton2017",
            "type": "article",
            "title": "Gaussian boson sampling",
            "authors": "Craig S. Hamilton, Regina Kruse, Linda Sansoni, Sonja Barkhofen, Christine Silberhorn, and Igor Jex",
            "year": "2017",
            "journal": "Physical Review Letters",
            "doi": "10.1103/PhysRevLett.119.170501",
            "url": ""
        },
        {
            "id": "aaronson2013",
            "type": "article",
            "title": "The computational complexity of linear optics",
            "authors": "Scott Aaronson and Alex Arkhipov",
            "year": "2013",
            "journal": "Theory of Computing",
            "doi": "10.4086/toc.2013.v009a004",
            "url": ""
        },
        {
            "id": "Bourassa2020",
            "type": "article",
            "title": "Blueprint for a scalable photonic fault-tolerant quantum computer",
            "authors": "Bourassa, J. E., Alexander, R. N., Vasmer, et al.",
            "year": "2020",
            "journal": "",
            "url": ""
        }
    ],
    "basedOnPapers": [],
    "referencedByPapers": [],
    "relatedContent": [
        {
            "type": "demonstration",
            "id": "tutorial_gaussian_transformation",
            "weight": 1.0
        },
        {
            "type": "demonstration",
            "id": "qsim_beyond_classical",
            "weight": 1.0
        },
        {
            "type": "demonstration",
            "id": "qonn",
            "weight": 1.0
        },
        {
            "type": "demonstration",
            "id": "tutorial_photonics",
            "weight": 1.0
        }
    ]
}