{
    "title": "Learning to learn with quantum neural networks",
    "authors": [
        {
            "id": "stefano_mangini"
        }
    ],
    "dateOfPublication": "2021-03-02T00:00:00+00:00",
    "dateOfLastModification": "2023-08-28T00:00:00+00:00",
    "categories": [
        "Quantum Machine Learning"
    ],
    "tags": [],
    "previewImages": [
        {
            "type": "thumbnail",
            "uri": "/_images/l2l_thumbnail.png"
        }
    ],
    "seoDescription": "Use a classical recurrent neural network to initilize the parameters of a variational quatum algorithm.",
    "doi": "",
    "canonicalURL": "/qml/demos/tutorial_learning2learn",
    "references": [],
    "basedOnPapers": [],
    "referencedByPapers": [],
    "relatedContent": [
        {
            "type": "demonstration",
            "id": "tutorial_qaoa_intro",
            "weight": 1.0
        },
        {
            "type": "demonstration",
            "id": "tutorial_qaoa_maxcut",
            "weight": 1.0
        }
    ]
}
