{
    "title": "How to quantum just-in-time compile VQE with Catalyst",
    "authors": [
        {
            "id": "josh_izaac"
        }
    ],
    "dateOfPublication": "2024-05-07T00:00:00+00:00",
    "dateOfLastModification": "2024-05-07T00:00:00+00:00",
    "categories": [
        "Quantum Machine Learning",
        "Optimization",
        "Quantum Chemistry"
    ],
    "tags": ["how to"],
    "previewImages": [
        {
            "type": "thumbnail",
            "uri": "/_static/demonstration_assets/regular_demo_thumbnails/thumbnail_brief_overview_of_VQE.png"
        },
        {
            "type": "large_thumbnail",
            "uri": "/_static/large_demo_thumbnails/thumbnail_large_How_to_optimize_QML_model_using_JAX_and_Optax_2024-01-16.png"
        }
    ],
    "seoDescription": "Learn how to find the ground state of a molecule with VQE using PennyLane, Catalyst, and just-in-time compilation.",
    "doi": "",
    "canonicalURL": "/qml/demos/tutorial_how_to_quantum_just_in_time_compile_vqe_catalyst.ipynb",
    "references": [],
    "basedOnPapers": [],
    "referencedByPapers": [],
    "relatedContent": [
        {
            "type": "demonstration",
            "id": "tutorial_How_to_optimize_QML_model_using_JAX_catalyst_and_Optax",
            "weight": 1.0
        },
        {
            "type": "demonstration",
            "id": "tutorial_vqe",
            "weight": 1.0
        }
    ]
}
