{
    "title": "Post Variational Quantum Neural Networks",
    "authors": [
        {
            "id": "elaina_zhu"
        },
        {
            "id": "po_wei_huang"
        }
    ],
    "dateOfPublication": "2023-04-03T00:00:00+00:00",
    "dateOfLastModification": "2024-01-01T00:00:00+00:00",
    "categories": [
        "Quantum Machine Learning"
    ],
    "tags": [],
    "previewImages": [
        {
            "type": "thumbnail",
            "uri": "/_static/demonstration_assets/here_comes_the_sun/thumbnail_tutorial_here_comes_the_sun.png"
        },
        {
            "type": "large_thumbnail",
            "uri": "/_static/large_demo_thumbnails/thumbnail_large_here_comes_the_sun.png"
        }
    ],
    "seoDescription": "Learn about multivariate quantum gates for optimization",
    "doi": "",
    "canonicalURL": "/qml/demos/Post_Variational_Quantum_Neural_Networks",
    "references": [
        {
            "id": "cerezo2021variational",
            "type": "article",
            "title": "Variational quantum algorithms",
            "authors": "M. Cerezo and Andrew Arrasmith and Ryan Babbush and Simon C. Benjamin and Suguru Endo and Keisuke Fujii and Jarrod R. McClean and Kosuke Mitarai and Xiao Yuan and Lukasz Cincio and Patrick J. Coles",
            "year": "2021",
            "publisher": "Springer Science and Business Media LLC",
            "journal": "Nature Reviews Physics",
            "doi": "10.1038/s42254-021-00348-9",
            "url": "https://doi.org/10.1038/s42254-021-00348-9"
        },
        {
            "id": "mcclean2018barren",
            "type": "article",
            "title": "Barren plateaus in quantum neural network training landscapes",
            "authors": "Jarrod R. McClean and Sergio Boixo and Vadim N. Smelyanskiy and Ryan Babbush and Hartmut Neven",
            "year": "2018",
            "journal": "Nature Communications",
            "doi": "10.1038/s41467-018-07090-4"
        },
        {
            "id": "du2020expressive",
            "type": "article",
            "title": "Expressive power of parametrized quantum circuits",
            "authors": "Du, Yuxuan and Hsieh, Min-Hsiu and Liu, Tongliang and Tao, Dacheng",
            "year": "2020",
            "publisher": "American Physical Society",
            "journal": "Phys. Rev. Res.",
            "doi": "10.1103/PhysRevResearch.2.033125",
            "url": "https://link.aps.org/doi/10.1103/PhysRevResearch.2.033125"
        },
        {
            "id": "schuld2019evaluating",
            "type": "article",
            "title": "Evaluating analytic gradients on quantum hardware",
            "authors": "Schuld, Maria and Bergholm, Ville and Gogolin, Christian and Izaac, Josh and Killoran, Nathan",
            "year": "2019",
            "journal": "Phys. Rev. A",
            "doi": "10.1103/PhysRevA.99.032331",
            "url": "https://doi.org/10.1103/PhysRevA.99.032331"
        },
        {
            "id": "huang2024postvariational",
            "type": "article",
            "title": "Post-variational quantum neural networks",
            "authors": "Po-Wei Huang and Patrick Rebentrost",
            "year": "2024",
            "doi": "10.48550/arXiv.2307.10560",
            "url": "https://arxiv.org/pdf/2307.10560"
        }
    ],
    "basedOnPapers": [],
    "referencedByPapers": [],
    "relatedContent": []
}