{
    "title": "Learning Dynamics Incoherently",
    "authors": [
        {
            "id": "diego_guala"
        }
    ],
    "dateOfPublication": "2024-07-09T00:00:00+00:00",
    "dateOfLastModification": "2024-07-09T00:00:00+00:00",
    "categories": [
        "Quantum Machine Learning"
    ],
    "tags": [],
    "previewImages": [
        {
            "type": "thumbnail",
            "uri": "/_static/demonstration_assets/regular_demo_thumbnails/thumbnail_learning_dynamics_incoherently.png"
        },
        {
            "type": "large_thumbnail",
            "uri": "/_static/large_demo_thumbnails/thumbnail_large_learning_dynamics_incoherently.png"
        }
    ],
    "seoDescription": "Learning Dynamics Incoherently",
    "doi": "",
    "canonicalURL": "/qml/demos/learning_dynamics_incoherently",
    "references": [
        {
            "id": "jerbi2023power",
            "type": "article",
            "title": "The power and limitations of learning quantum dynamics incoherently",
            "authors": "Sofiene Jerbi, Joe Gibbs, Manuel S. Rudolph, Matthias C. Caro, Patrick J. Coles, Hsin-Yuan Huang, and ZoÃ« Holmes",
            "year": "2023",
            "url": "https://arxiv.org/abs/2303.12834"
        }
    ],
    "basedOnPapers": ["10.48550/arXiv.2303.12834"],
    "referencedByPapers": [],
    "relatedContent": [
        {
            "type": "demonstration",
            "id": "tutorial_haar_measure",
            "weight": 1.0
        }
    ]
}
