{
    "title": "Neutral-atom quantum computers",
    "authors": [
        {
            "id": "alvaro_ballon"
        }
    ],
    "dateOfPublication": "2023-05-30T00:00:00+00:00",
    "dateOfLastModification": "2023-05-30T00:00:00+00:00",
    "categories": [
        "Quantum Hardware",
        "Quantum Computing"
    ],
    "tags": [],
    "previewImages": [
        {
            "type": "thumbnail",
            "uri": "/_static/demonstration_assets/neutral_atoms/thumbnail_tutorial_neutral_atoms.png"
        },
        {
            "type": "large_thumbnail",
            "uri": "/_static/large_demo_thumbnails/thumbnail_large_neutral_atoms.png"
        }
    ],
    "seoDescription": "Learn how neutral atom quantum devices work using code.",
    "doi": "",
    "canonicalURL": "/qml/demos/tutorial_neutral_atoms",
    "references": [
        {
            "id": "Aquila2022",
            "type": "webpage",
            "title": "Aquila, our 256-qubit quantum processor.",
            "authors": "Quera",
            "year": "2023",
            "journal": "",
            "url": "https://www.quera.com/aquila"
        },
        {
            "id": "DiVincenzo2000",
            "type": "article",
            "title": "The Physical Implementation of Quantum Computation.",
            "authors": "DiVincenzo",
            "year": "2000",
            "journal": "Fortschritte der Physik 48",
            "url": "https://arxiv.org/abs/quant-ph/0002077"
        },
        {
            "id": "Tweezers1985",
            "type": "article",
            "title": "Observation of a single-beam gradient force optical trap for dielectric particles.",
            "authors": "A. Ashkin, J. M. Dziedzic, J. E. Bjorkholm, and Steven Chu.",
            "year": "1986",
            "journal": "",
            "url": ""
        },
        {
            "id": "AtomComputing",
            "type": "webpage",
            "title": "Quantum Computing Technology.",
            "authors": "Atom Computing",
            "year": "2023",
            "journal": "",
            "url": "https://atom-computing.com/quantum-computing-technology"
        },
        {
            "id": "Neutral2020",
            "type": "article",
            "title": "Quantum computing with neutral atoms.",
            "authors": "L. Henriet, et al.",
            "year": "2020",
            "journal": "Quantum volume",
            "url": "https://arxiv.org/abs/2006.12326"
        },
        {
            "id": "Pulser2022",
            "type": "article",
            "title": "Pulser: An open-source package for the design of pulse sequences in programmable neutral-atom arrays.",
            "authors": "H. Silverio et al.",
            "year": "2022",
            "journal": "Quantum volume",
            "url": "https://arxiv.org/abs/2104.15044"
        },
        {
            "id": "Morgado2011",
            "type": "article",
            "title": "Quantum simulation and computing with Rydberg-interacting qubits",
            "authors": "M. Morgado and S. Whitlock.",
            "year": "2021",
            "journal": "AVS Quantum Sci.",
            "url": "https://arxiv.org/abs/2011.03031"
        },
        {
            "id": "NeutralHardware2023",
            "type": "article",
            "title": "Neutral Atom Quantum Computing Hardware: Performance and End-User Perspective.",
            "authors": "K. Wintersperger et al.",
            "year": "2023",
            "journal": "",
            "url": "https://arxiv.org/abs/2304.14360"
        }
    ],
    "basedOnPapers": [],
    "referencedByPapers": [],
    "relatedContent": [
        {
            "type": "demonstration",
            "id": "tutorial_pasqal",
            "weight": 1.0
        },
        {
            "type": "demonstration",
            "id": "ahs_aquila",
            "weight": 1.0
        },
        {
            "type": "demonstration",
            "id": "tutorial_pulse_programming101",
            "weight": 1.0
        },
        {
            "type": "demonstration",
            "id": "tutorial_trapped_ions",
            "weight": 1.0
        },
        {
            "type": "demonstration",
            "id": "tutorial_sc_qubits",
            "weight": 1.0
        },
        {
            "type": "demonstration",
            "id": "tutorial_photonics",
            "weight": 1.0
        }
    ]
}