{
    "title": "Circuits as Fourier series",
    "authors": [
        {
            "id": "david_wakeham"
        }
    ],
    "dateOfPublication": "2023-06-26T00:00:00",
    "dateOfLastModification": "2023-06-26T00:00:00",
    "categories": [
        "Quantum Computing",
        "Optimization",
        "Quantum Machine Learning"
    ],
    "tags": [],
    "previewImages": [
        {
            "type": "thumbnail",
            "uri": "/_images/thumbnail_tutorial_mitigation_advantage.png"
        },
        {
            "type": "large_thumbnail",
            "uri": "/_static/large_demo_thumbnails/thumbnail_large_mitigation_advantage.png"
        }
    ],
    "seoDescription": "TODO",
    "doi": "",
    "canonicalURL": "/qml/demos/circuits_as_fourier_series",
    "references": [],
    "basedOnPapers": [],
    "referencedByPapers": [],
    "relatedContent": [
        {
            "type": "demonstration",
            "id": "tutorial_expressivity_fourier_series",
            "weight": 1.0
        },
        {
            "type": "demonstration",
            "id": "tutorial_general_parshift",
            "weight": 1.0
        },
        {
            "type": "demonstration",
            "id": "tutorial_stochastic_parameter_shift",
            "weight": 1.0
        }
    ]
}
