{
    "title": "How to optimize a QML model using Catalyst and quantum just-in-time (QJIT) compilation",
    "authors": [
        {
            "id": "josh_izaac"
        }
    ],
    "dateOfPublication": "2024-05-07T00:00:00+00:00",
    "dateOfLastModification": "2024-05-07T00:00:00+00:00",
    "categories": [
        "Quantum Machine Learning",
        "Optimization"
    ],
    "tags": ["how to"],
    "previewImages": [
        {
            "type": "thumbnail",
            "uri": "/_static/demonstration_assets/regular_demo_thumbnails/thumbnail_how-to-optimize-qjit-optax.png"
        },
        {
            "type": "large_thumbnail",
            "uri": "/_static/large_demo_thumbnails/thumbnail_large_how-to-optimize-qjit-optax.png"
        }
    ],
    "seoDescription": "Learn how to train a quantum machine learning model using PennyLane, JAX, Catalyst, and Optax.",
    "doi": "",
    "canonicalURL": "/qml/demos/tutorial_How_to_optimize_QML_model_using_JAX_catalyst_and_Optax",
    "references": [],
    "basedOnPapers": [],
    "referencedByPapers": [],
    "relatedContent": [
        {
            "type": "demonstration",
            "id": "tutorial_How_to_optimize_QML_model_using_JAX_and_Optax",
            "weight": 1.0
        },
        {
            "type": "demonstration",
            "id": "tutorial_jax_transformations",
            "weight": 1.0
        },
        {
            "type": "demonstration",
            "id": "tutorial_variational_classifier",
            "weight": 1.0
        }
    ]
}
